{"all_features_causal":true,"definitions":{"opposite_top1_lots":"displayed lots at the opposite best quote","opposite_top5_lots":"sum of opposite-side displayed lots across configured top levels","quote_age_ns":"source cutoff minus time the current passive-side best price became current","realized_abs_mid_move_1s_half_ticks":"sum absolute mid_x2 changes over the trailing 1s","realized_abs_mid_move_5s_half_ticks":"sum absolute mid_x2 changes over the trailing 5s","same_top1_lots":"displayed lots at the passive-side best quote","same_top5_lots":"sum of passive-side displayed lots across configured top levels","side_imbalance_top1_bps":"10000*(same_top1-opposite_top1)/(same_top1+opposite_top1), truncated toward zero","side_imbalance_top5_bps":"10000*(same_top5-opposite_top5)/(same_top5+opposite_top5), truncated toward zero","side_mid_move_1s_half_ticks":"side_sign*(current_mid_x2-past_mid_x2) at 1s lookback","side_mid_move_250ms_half_ticks":"side_sign*(current_mid_x2-past_mid_x2) at 250ms lookback","side_mid_move_5s_half_ticks":"side_sign*(current_mid_x2-past_mid_x2) at 5s lookback","spread_change_1s_ticks":"current spread minus spread at 1s lookback","spread_ticks":"best_ask_ticks - best_bid_ticks","time_since_last_trade_ns":"source cutoff minus latest causal trade time; censored at max_window+1 if none","toward_quote_trade_flow_1s_lots":"side-normalized signed aggressor flow over (cutoff-1s, cutoff]","toward_quote_trade_flow_250ms_lots":"side-normalized signed aggressor flow over (cutoff-250ms, cutoff]","toward_quote_trade_flow_5s_lots":"side-normalized signed aggressor flow over (cutoff-5s, cutoff]","trade_count_1s":"trade count over (cutoff-1s, cutoff]","trade_count_5s":"trade count over (cutoff-5s, cutoff]"},"feature_count":20,"feature_names":["spread_ticks","same_top1_lots","opposite_top1_lots","same_top5_lots","opposite_top5_lots","side_imbalance_top1_bps","side_imbalance_top5_bps","toward_quote_trade_flow_250ms_lots","toward_quote_trade_flow_1s_lots","toward_quote_trade_flow_5s_lots","trade_count_1s","trade_count_5s","side_mid_move_250ms_half_ticks","side_mid_move_1s_half_ticks","side_mid_move_5s_half_ticks","realized_abs_mid_move_1s_half_ticks","realized_abs_mid_move_5s_half_ticks","spread_change_1s_ticks","quote_age_ns","time_since_last_trade_ns"],"schema_version":"prediction-feature-dictionary-v1","uses_exact_historical_queue_position":false,"uses_future_volume_profile":false}
